{
  "khp": "1.0",
  "id": "kit.mock",
  "name": "Mock",
  "version": "0.0.0",
  "license": "Apache-2.0",
  "engine": { "module": "kition_kit_mock", "class": "MockDocument", "contract": 1 },
  "formats": [{ "id": "mock", "extensions": ["mocktext"], "mime": "text/plain", "role": "edit" }],
  "agent": { "prefix": "mock", "tools": "document", "drafts": false, "objectModel": true, "layout": false },
  "headless": {
    "executable": "kition-kit-mock",
    "protocol": "kition-kit/1",
    "features": ["view.describe", "model.describe", "model.batch"]
  }
}
